{
  "source_id": "S-084",
  "title": "NIST NCCoE DevSecOps Practices",
  "url": "https://pages.nist.gov/nccoe-devsecops/",
  "canonical_url": "https://pages.nist.gov/nccoe-devsecops/",
  "author_or_organization": "",
  "publisher": "NIST",
  "retrieved_at": "2026-05-31T13:59:06+00:00",
  "local_snapshots": [
    {
      "snapshot_id": "SNAP-20260531T135906Z",
      "local_path": "sources/S-084/raw/SNAP-20260531T135906Z.html",
      "content_hash": "sha256:db8e2c1b895a30773a764a6a492d82b1e15e690927e4d5723589637d8b858187",
      "mime_type": "text/html",
      "captured_at": "2026-05-31T13:59:06+00:00"
    }
  ],
  "freshness": {
    "mode": "periodic",
    "recheck_after": "2026-06-30T13:59:06+00:00",
    "reason": "Living documentation or repository page; refresh before relying on current-state claims."
  },
  "source_type": "official_documentation",
  "evidence_tier": "A",
  "quality": {
    "authority": "high",
    "directness": "high",
    "recency": "medium",
    "transparency": "high",
    "independence": "medium",
    "reproducibility": "medium",
    "notes": "Heuristic initial evaluation. Agent review is required before publication. Repository default-branch pages remain provisional unless an immutable permalink is stored."
  },
  "conflict_of_interest": "",
  "evidence_chain": "https://pages.nist.gov/nccoe-devsecops/",
  "supported_claim_ids": [
    "C-006"
  ],
  "content_hash": "sha256:db8e2c1b895a30773a764a6a492d82b1e15e690927e4d5723589637d8b858187",
  "locator": "local snapshot SNAP-20260531T135906Z"
}
