{
  "source_id": "S-050",
  "title": "OpenSpec for Copilot Repository README",
  "url": "https://github.com/atman-33/openspec-for-copilot",
  "canonical_url": "https://github.com/atman-33/openspec-for-copilot",
  "author_or_organization": "",
  "publisher": "atman-33",
  "retrieved_at": "2026-05-31T12:12:32+00:00",
  "local_snapshots": [
    {
      "snapshot_id": "SNAP-20260531T121232Z",
      "local_path": "sources/S-050/raw/SNAP-20260531T121232Z.html",
      "content_hash": "sha256:049de663ae39d397166e530fb2413f1e54954982ccd2b07e4fcb22a8b6aef8c0",
      "mime_type": "text/html",
      "captured_at": "2026-05-31T12:12:32+00:00"
    }
  ],
  "freshness": {
    "mode": "periodic",
    "recheck_after": "2026-06-30T12:12:32+00:00",
    "reason": "Living documentation or repository page; refresh before relying on current-state claims."
  },
  "source_type": "repository_file",
  "evidence_tier": "B",
  "quality": {
    "authority": "medium",
    "directness": "high",
    "recency": "medium",
    "transparency": "high",
    "independence": "medium",
    "reproducibility": "high",
    "notes": "Heuristic initial evaluation. Agent review is required before publication. Repository default-branch pages remain provisional unless an immutable permalink is stored."
  },
  "conflict_of_interest": "",
  "evidence_chain": "https://github.com/atman-33/openspec-for-copilot",
  "supported_claim_ids": [],
  "content_hash": "sha256:049de663ae39d397166e530fb2413f1e54954982ccd2b07e4fcb22a8b6aef8c0",
  "locator": "repository tree",
  "commit_sha": "e2c933e567199de8b42feea7314a530af8f98a9a",
  "immutable_url": "https://github.com/atman-33/openspec-for-copilot/tree/e2c933e567199de8b42feea7314a530af8f98a9a"
}
