{
  "source_id": "S-014",
  "title": "Spec Workflow MCP Repository README",
  "url": "https://github.com/mamajiaa/specs-workflow-mcp",
  "canonical_url": "https://github.com/mamajiaa/specs-workflow-mcp",
  "author_or_organization": "",
  "publisher": "mamajiaa",
  "retrieved_at": "2026-05-31T11:39:00+00:00",
  "local_snapshots": [
    {
      "snapshot_id": "SNAP-20260531T113900Z",
      "local_path": "sources/S-014/raw/SNAP-20260531T113900Z.html",
      "content_hash": "sha256:7a5efb8e9148c7391023c31f9f1c25e2763822e2b55000e2f0fbedb84e84b333",
      "mime_type": "text/html",
      "captured_at": "2026-05-31T11:39:00+00:00"
    }
  ],
  "freshness": {
    "mode": "periodic",
    "recheck_after": "2026-06-30T11:39:00+00:00",
    "reason": "Living documentation or repository page; refresh before relying on current-state claims."
  },
  "source_type": "repository_file",
  "evidence_tier": "B",
  "quality": {
    "authority": "medium",
    "directness": "high",
    "recency": "medium",
    "transparency": "high",
    "independence": "medium",
    "reproducibility": "high",
    "notes": "Heuristic initial evaluation. Agent review is required before publication. Repository default-branch pages remain provisional unless an immutable permalink is stored."
  },
  "conflict_of_interest": "",
  "evidence_chain": "https://github.com/mamajiaa/specs-workflow-mcp",
  "supported_claim_ids": [],
  "content_hash": "sha256:7a5efb8e9148c7391023c31f9f1c25e2763822e2b55000e2f0fbedb84e84b333",
  "locator": "repository tree",
  "commit_sha": "5d08dac63d80a8e585e26b2513b5ede440787fac",
  "immutable_url": "https://github.com/mamajiaa/specs-workflow-mcp/tree/5d08dac63d80a8e585e26b2513b5ede440787fac"
}
