{
  "source_id": "S-041",
  "title": "OWASP Agentic Skills Top 10",
  "url": "https://owasp.org/www-project-agentic-skills-top-10/",
  "canonical_url": "https://owasp.org/www-project-agentic-skills-top-10/",
  "author_or_organization": "",
  "publisher": "",
  "retrieved_at": "2026-06-07T00:42:01+00:00",
  "local_snapshots": [
    {
      "snapshot_id": "SNAP-20260607T004201Z",
      "local_path": "sources/S-041/raw/SNAP-20260607T004201Z.html",
      "content_hash": "sha256:bba33dd6c6af9eddb327d8b631cc5619a56bcfa3961fb84df0eb9a12dd86506b",
      "mime_type": "text/html",
      "captured_at": "2026-06-07T00:42:01+00:00"
    }
  ],
  "source_type": "official_documentation",
  "conflict_of_interest": "",
  "evidence_chain": "https://owasp.org/www-project-agentic-skills-top-10/",
  "supported_claim_ids": [
    "C-003",
    "C-006",
    "C-009",
    "C-010"
  ],
  "content_hash": "sha256:bba33dd6c6af9eddb327d8b631cc5619a56bcfa3961fb84df0eb9a12dd86506b",
  "locator": "local snapshot SNAP-20260607T004201Z",
  "freshness": {
    "mode": "periodic",
    "recheck_after": "2026-07-07T00:42:01+00:00",
    "reason": "Living documentation or repository page; refresh before relying on current-state claims."
  },
  "evidence_tier": "A",
  "quality": {
    "authority": "high",
    "directness": "high",
    "recency": "medium",
    "transparency": "high",
    "independence": "medium",
    "reproducibility": "medium",
    "notes": "Heuristic initial evaluation. Agent review is required before publication. Repository default-branch pages remain provisional unless an immutable permalink is stored.",
    "review_summary": "OWASP Agentic Skills Top 10. Directly relevant to the user's question about agent skills as a separate attack surface.",
    "category": "Security"
  }
}
