{
  "source_id": "S-042",
  "title": "Maestro Orchestrate Repository README",
  "url": "https://github.com/josstei/maestro-orchestrate",
  "canonical_url": "https://github.com/josstei/maestro-orchestrate",
  "author_or_organization": "",
  "publisher": "josstei",
  "retrieved_at": "2026-05-31T12:12:22+00:00",
  "local_snapshots": [
    {
      "snapshot_id": "SNAP-20260531T121222Z",
      "local_path": "sources/S-042/raw/SNAP-20260531T121222Z.html",
      "content_hash": "sha256:5f7a62fbc09ea10bbc782b60bed2c59521a3db229a4e6f8dec4fa5c788b0e0b3",
      "mime_type": "text/html",
      "captured_at": "2026-05-31T12:12:22+00:00"
    }
  ],
  "freshness": {
    "mode": "periodic",
    "recheck_after": "2026-06-30T12:12:22+00:00",
    "reason": "Living documentation or repository page; refresh before relying on current-state claims."
  },
  "source_type": "repository_file",
  "evidence_tier": "B",
  "quality": {
    "authority": "medium",
    "directness": "high",
    "recency": "medium",
    "transparency": "high",
    "independence": "medium",
    "reproducibility": "high",
    "notes": "Heuristic initial evaluation. Agent review is required before publication. Repository default-branch pages remain provisional unless an immutable permalink is stored."
  },
  "conflict_of_interest": "",
  "evidence_chain": "https://github.com/josstei/maestro-orchestrate",
  "supported_claim_ids": [],
  "content_hash": "sha256:5f7a62fbc09ea10bbc782b60bed2c59521a3db229a4e6f8dec4fa5c788b0e0b3",
  "locator": "repository tree",
  "commit_sha": "4f5d434dded8a5e58808ad60f56c6e410f57cf7e",
  "immutable_url": "https://github.com/josstei/maestro-orchestrate/tree/4f5d434dded8a5e58808ad60f56c6e410f57cf7e"
}
