{
  "source_id": "S-033",
  "title": "Anthropic Building Effective Agents",
  "url": "https://www.anthropic.com/engineering/building-effective-agents",
  "canonical_url": "https://www.anthropic.com/engineering/building-effective-agents",
  "author_or_organization": "",
  "publisher": "",
  "retrieved_at": "2026-06-07T00:39:59+00:00",
  "local_snapshots": [
    {
      "snapshot_id": "SNAP-20260607T003959Z",
      "local_path": "sources/S-033/raw/SNAP-20260607T003959Z.html",
      "content_hash": "sha256:8a36899ad8329f3da6d3c582d96a79facd062f8ddbbae7ec43051ff16c418fa3",
      "mime_type": "text/html",
      "captured_at": "2026-06-07T00:39:59+00:00"
    }
  ],
  "source_type": "official_documentation",
  "conflict_of_interest": "",
  "evidence_chain": "https://www.anthropic.com/engineering/building-effective-agents",
  "supported_claim_ids": [
    "C-002",
    "C-004"
  ],
  "content_hash": "sha256:8a36899ad8329f3da6d3c582d96a79facd062f8ddbbae7ec43051ff16c418fa3",
  "locator": "local snapshot SNAP-20260607T003959Z",
  "freshness": {
    "mode": "periodic",
    "recheck_after": "2026-07-07T00:39:59+00:00",
    "reason": "Living documentation or repository page; refresh before relying on current-state claims."
  },
  "evidence_tier": "A",
  "quality": {
    "authority": "high",
    "directness": "high",
    "recency": "medium",
    "transparency": "high",
    "independence": "medium",
    "reproducibility": "medium",
    "notes": "Heuristic initial evaluation. Agent review is required before publication. Repository default-branch pages remain provisional unless an immutable permalink is stored.",
    "review_summary": "Anthropic building effective agents article. Important counterweight: prefer simple workflows first, then add agentic systems when flexibility is worth the cost.",
    "category": "Framework orchestration"
  }
}
